id,created_at,text,no_of_retweets,no_of_favorite
559012822978289664,2015-01-24 15:40:17,Was interesting to hear challenges faced by @GaryLineker &amp; @JoeMontana at a dinner hosted by Indra nooyi at davos http://t.co/7P1zux78Fs,474,1033
555645838848847873,2015-01-15 08:41:06,Wished her success and wrote a message. Enjoy the game and always give your best,447,1020
555645655775838208,2015-01-15 08:40:22,Met Sarita Devi. Could see the hunger for action in her eyes. http://t.co/H3tcB9z3fa,690,1332
550549480366297089,2015-01-01 07:09:59,"Happy New Year! Breakfast at Chaar Dukaan, Mussoorie. Had amazing bun omelette and parathas with dahi n pickle http://t.co/HB3Jr9M8a3",1169,3079
549871862025424896,2014-12-30 10:17:22,well done on a wonderful career in test cricket @msdhoni. Always enjoyed playing together. Next target 2015 WC my friend!!,8357,8541
549076054359285761,2014-12-28 05:35:07,Wish that basic facts are checked from me before publishing such fiction using my name.,1118,1245
549075957609267201,2014-12-28 05:34:44,I have not even planned any academy neither do I want any piece of land for any purpose.,1131,990
549075837215989762,2014-12-28 05:34:15,I am appalled to read the stories that suggest some land has been asked from IIT-D for academy in my name.,1231,902
548058556524531712,2014-12-25 10:11:56,"glorious day, beauty of nature, ek selfie to banta hain!! http://t.co/nOd2gYKkqs",1425,3241
548005830943969280,2014-12-25 06:42:26,Wishing you a Merry Christmas http://t.co/bWOmKICinw,838,1763
547733464858914817,2014-12-24 12:40:09,Bharat Ratna being awarded to Pandit Madan Mohan and Atalji recognises their selfless dedication and tremendous contribution to the country,1198,1709
547629650281627648,2014-12-24 05:47:37,Up in the mountains for a winter break. Unbelievably cold here. Absolutely Freezing!! http://t.co/pMucA31Ipr,654,1645
546532422594985984,2014-12-21 05:07:38,"Great inaugural ISL season. Well played @KBFCOfficial team, proud of your display. Congrats @atletidekolkata",772,1290
546253964203663361,2014-12-20 10:41:08,Off to cheer the boys in yellow #KeralaForTheFinals #yellowmeinkhelo http://t.co/VfiFCIPuUi,694,1372
543804935997911040,2014-12-13 16:29:34,That was a Blaster performance @KBFCOfficial.Fantastic crowd support.Enjoyed with @ImZaheer &amp; @YUVSTRONG12 http://t.co/E682WGZvoG,1330,2207
542345426603487233,2014-12-09 15:50:00,Well done @KBFCOfficial simply magnificent play !!! Thanks a lot to all our supporters :-),623,1083
542335322713890817,2014-12-09 15:09:51,Recalled some of the memorable playing days with the Guinness World Records team #gwr60,320,719
541899842163720192,2014-12-08 10:19:25,Congratulations to Indian Visually Impaired Cricket team on winning the World Cup. Should inspire the potential world beaters in the country,1596,1950
540011090516508672,2014-12-03 05:14:11,Will miss you Phil. Your enthusiasm to learn and drive for perfection was most impressive. #FarewellHughes http://t.co/5tpK0asSFg,2677,3574
538299716203601920,2014-11-28 11:53:48,My bat when I was 25. RIP Phil. #putoutyourbats http://t.co/tFWYdfNxoc,8237,8073
537851491726282752,2014-11-27 06:12:43,"Shocked to hear about Phil. Sad day for cricket. Deepest condolences to family, friends and well wishers. RIP #PhilipHughes",4704,3821
537521511410581504,2014-11-26 08:21:29,Lovely meeting some of my team mates from the victorious World Cup team. Terrific time catching up! http://t.co/WnAjscl4na,862,2008
537499841601867776,2014-11-26 06:55:23,"Phil is fighting hard and we are with him in this fight. My prayers with him, his family and friends #prayforhughesy",1927,2271
535486393099632640,2014-11-20 17:34:39,A wonderful dinner at Yuuka. Paul Kinny's Japanese food was simply delicious!!! http://t.co/OOTVESUBF2,501,1435
535080954880987137,2014-11-19 14:43:35,Had a wonderful session with  @KatieS @rsjaitly from #Twitter. Discussed many ideas including #SwachhBharat with them to make a difference,373,792
534231689749225472,2014-11-17 06:28:55,A time well spent planning with administration on how to positively impact lives.,365,807
534231581213212672,2014-11-17 06:28:29,An immensely satisfying morning with future citizens of Puttamraju Kandriga. http://t.co/j3t0Sh0IUS,495,1136
534018438981640192,2014-11-16 16:21:32,A day which started with witnessing Indian village's passion for life inspite of limited avenues.,732,1406
534018226569498624,2014-11-16 16:20:41,"India 5-0, Srikant 2-0, Saina 2-0, Kerala Blasters 1-0. Could not have asked for a better day.",3553,4402
532586440014569472,2014-11-12 17:31:16,loving the crowd spirit here at the stadium in Kochi #YellowOrNothing http://t.co/f0dHeceLHc,603,1447
531347398912536576,2014-11-09 07:27:46,Enjoyed dinner after hectic couple of days in the UK http://t.co/sXDlhXSRgD,559,1529
531347052517543936,2014-11-09 07:26:23,Great to be able to follow my batting hero @vivrichards56 on twitter,454,855
531146571891494912,2014-11-08 18:09:45,Meeting fans in Birmingham. Fond memories of my test century with Anjali watching me In the stadium. #PlayingItMyWay http://t.co/u9S9ekUrd2,496,1054
530713978268164097,2014-11-07 13:30:47,Starting the #PlayingItMyWayLaunch in London with former England Captain Nasser Hussain. http://t.co/hYKsPhzyfZ,478,978
530588542695911424,2014-11-07 05:12:21,Thank you @KBFCOfficial for the superb win in 1st home game. Amazing atmosphere in the stadium. #YellowOrNothing http://t.co/RlbjmVYiHq,425,884
530332442016505856,2014-11-06 12:14:41,I'll be in yellow to support @KBFCOfficial. Come join me at the JN Stadium tonight. Lets cheer them on to a WIN #KBFC #YellowOrNothing,266,561
530003318680993792,2014-11-05 14:26:52,Achrekar Sir and Sara.... #PlayingItMyWayLaunch http://t.co/ihkOrTx0Un,669,1289
530000537815502848,2014-11-05 14:15:49,#PlayingItMyWayLaunch http://t.co/Ae77MuKtsJ,642,1043
529996341250752512,2014-11-05 13:59:09,Ajit and Anjali.... #PlayingItMyWayLaunch http://t.co/Nu2kXMp6Z6,502,993
529992171412144130,2014-11-05 13:42:35,@bhogleharsha Rahul Dravid Saurav Ganguly VVS Laxman... #PlayingItMyWayLaunch http://t.co/o906bWV96l,514,680
529985957072621568,2014-11-05 13:17:53,@bhogleharsha Sunil Gavaskar Ravi Shastri Dilip Vengsarkar Vasu Paranjape.... #PlayingItMyWayLaunch http://t.co/o6U0x8q63i,237,429
529970480300560385,2014-11-05 12:16:23,There’s a restless feeling knocking on my door today on the eve of my book launch need all your love and support  #PlayingItMyWayLaunch,1064,1567
529937144127569920,2014-11-05 10:03:55,Gave the first copy of my book to my mother.Look of pride on her face was a priceless moment ! #PlayingItMyWayLaunch http://t.co/tjU2bxN0sw,2208,2969
529874326489530369,2014-11-05 05:54:18,Promo for my new show #TendulkarDecoded for those who missed it last night. What do you all think? http://t.co/8vGEOrDZKV,393,596
529694857950793728,2014-11-04 18:01:10,"Coming Soon !! http://t.co/8vGEOrDZKV  
#PlayingItMyWay",477,631
529171238103420928,2014-11-03 07:20:29,"A source of great relief !! #PlayingItMyWay 
http://t.co/Gy8DJWOo1c",278,523
528873734375866368,2014-11-02 11:38:18,My first mode of transportation and the first day was indeed a first show. Did not even have insurance then... http://t.co/57BmwBWdP8,253,496
528820767937396736,2014-11-02 08:07:50,"The Hamstring Injury !! #PlayingItMyWay 
https://t.co/P6gm7RV9tx",211,375
528438802696503297,2014-11-01 06:50:03,"Preview #5 from my book : A stern lesson in the early days on the Art of Flying …. Or is it Not Flying
http://t.co/HN393ZzIMw",228,403
528203552116588544,2014-10-31 15:15:15,"After taste of an Ice Cream !! #PlayingItMyWay 
http://t.co/gWAeLGHbGa",242,481
528160433656451072,2014-10-31 12:23:54,Preview #4 from my Book : ‘Drinks Break’ in early days !! http://t.co/CjatHh7rt1,176,368
527786651213246465,2014-10-30 11:38:38,"Great honour to be inducted into Don Bradman Hall of Fame.
http://t.co/hABpe5TXVw",871,1293
527423600899260416,2014-10-29 11:36:00,"The scar on my palm !! 

http://t.co/aYvnBoMzx3",305,496
526393390116524032,2014-10-26 15:22:18,"First point on the table, more around. Come on @KBFCOfficial #YellowMeinKhelo",342,690
525162013496844288,2014-10-23 05:49:15,Happy Diwali! Please make this Diwali special for some who Make a Wish! http://t.co/NEdA1WhVCh,1109,1836
524912036665241601,2014-10-22 13:15:56,The force of @superstarrajini sir was seen on the ground and with Chennai! Well played @KBFCOfficial http://t.co/UJHSaY6yeo,1029,1541
524471378234191872,2014-10-21 08:04:55,Enjoyed reading @vikramsathaye 's new book #HowSachinDestroyedMyLife. All the best ! Keep making us laugh :),394,689
524418633120755712,2014-10-21 04:35:20,Wear your Yellow jerseys with pride in support of the Blasters' first ever #HeroISL Southern Derby. #YellowMeinKhelo,394,618
523009808543137792,2014-10-17 07:17:10,Happy b'day @anilkumble1074 ...  A true champion on the field &amp; more importantly a good human,891,1249
522725083928743936,2014-10-16 12:25:46,"Shared his experience, interesting anecdotes and sound advice.... #SwachhBharat.. Swast Bharat.. Sach Bharat !!",1176,1975
522724899098337280,2014-10-16 12:25:02,It was wonderful meeting Prime Minister Modiji. Enthusiastically heard thoughts on #SportsForAll,1317,2089
522724310742355968,2014-10-16 12:22:42,RT @narendramodi: With @sachin_rt. http://t.co/GO6eCRuHqw,1993,0
522399994301542400,2014-10-15 14:53:59,Wash your hands before every meal.... Spread the word on #WorldHandWashDay #SwachhBharat.... http://t.co/cyIogy2K0E,762,767
522296357491445760,2014-10-15 08:02:10,"I have voted, am sure you have too !! http://t.co/bpIMhvG4Pm",716,1249
521941261545000963,2014-10-14 08:31:08,Tomorrow is a day to be a responsible citizen... Please cast your vote,934,1039
521689358198255618,2014-10-13 15:50:10,Good game boys @KBFCOfficial... You won a lot of hearts with the effort on the ground #yellowmeinkhelo aur dil se khelo,574,863
521568693902270465,2014-10-13 07:50:41,The Blasters kick off in a few hours! It's time to go to @KBFCOfficial and show the team your love using #WishTheBlasters #yellowmeinkhelo,504,630
520534987032907776,2014-10-10 11:23:06,It was the start of a good bye which I will always cherish and be forever indebted to all of you.,765,1110
520534870653538304,2014-10-10 11:22:38,This day last year I shared that I was preparing to play my last international series.,869,1187
520486468532187136,2014-10-10 08:10:18,"The Swachh Bharat Video : http://t.co/q53du3f0wX

 #CleanIndia #CleanIndiaCampaign",591,691
520117060253138944,2014-10-09 07:42:25,". @ImZaheer , @NSaina , Sardar Singh, Atul Ranade, @atulkasbekar , please spread the word .. Swachh Bharat Hi Sach Bharat Hai!",575,742
520108192689160192,2014-10-09 07:07:10,"Vikram Sathaye, Mohan Kumar (Taj Hotels), Anil Chadda (ITC Hotels) &amp; Vinod Naidu please spread the word .. Swachh Bharat Hi Sach Bharat Hai!",425,554
520107804778971136,2014-10-09 07:05:38,"@ImZaheer , @NSaina , Sardar Singh, Atul Ranade, @atulkasbekar , please spread the word .. Swachh Bharat Hi Sach Bharat Hai!",241,272
520106478779125760,2014-10-09 07:00:22,Swachh Bharat Hi Sach Bharat Hai! The story of Stinky Path to Footpath on film….. http://t.co/TzvYNgSlL9,527,592
519755506882080769,2014-10-08 07:45:44,Touch the Sky with Glory... exhilarating experience to be part of the Indian Air Force Day Celebrations http://t.co/6ndPYT86jX,839,1279
518747154882363392,2014-10-05 12:58:54,"36Hrs ago, a small initiative towards #SwachaBharat has begun! Do you know this Mumbai street? http://t.co/xt31ujsYLW http://t.co/jDu6MDnETb",1965,2351
518653290142126081,2014-10-05 06:45:55,"Aamir's @satyamevjayate episode was a déjà vu for me, sports4all will change country's future #MumkinHai",2666,3174
517589618221268992,2014-10-02 08:19:15,I humbly accept the challenge ... https://t.co/eGw712nT7z,1044,1254
517331767993184256,2014-10-01 15:14:39,Enjoyed Sadhya (lunch) with the Kerala Blasters @KBFCOfficial. Don't miss yellow in the pics!! #yellowmeinkhelo http://t.co/UMYDNbJ0NQ,708,1134
515139537740107777,2014-09-25 14:03:31,Amol's spirit left a mark and batting made a statement. Best wishes and welcome to the band of retired! #AmolMuzumdar,499,657
515139394781474817,2014-09-25 14:02:57,"One thing that #AmolMuzumdar always missed, the element of luck. Always dedicated and pursued his talent with passion and sincerity.",406,540
514764262888067072,2014-09-24 13:12:18,"The country is united in applauding efforts of the team @isro, I salute the silent achievers that has worked to make this happen #Mangalyaan",2278,2351
514731593852657664,2014-09-24 11:02:29,RT @KBFCOfficial: Use #YellowMeinKhelo to support @sachin_rt &amp; his team @KBFCOfficial Share a #selfie of yourself in YELLOW! http://t.co/vT…,250,0
514722139253923840,2014-09-24 10:24:55,Yellow is our colour. Show ur support for @KBFCOfficial by sending pics of you in Yellow. Tweet #YellowMeinKhelo http://t.co/lziBYuxWqw,616,721
513194353963978754,2014-09-20 05:14:03,Arjun did smash the ball during his knock at the Smaash Master Blaster Tournament http://t.co/JJ750LtHPq,710,1257
511523782603718656,2014-09-15 14:35:48,The @KBFCofficial crest is launched. Wishing the team good luck! #KeralaBlasters http://t.co/te5c0fAIVZ,530,696
510413389865054208,2014-09-12 13:03:29,"With 7' 2"" inches tall #IndianBasketball player Satnam Singh. Wishing the team all the very best for the #AsianGames http://t.co/jzbjaYj54x",767,1078
508557228064788480,2014-09-07 10:07:46,Onam Aashamsagal! A special Onam for the new born KeralaBlasters @KBFCOfficial Hope to enjoy Onam Sadhya in my visit  http://t.co/lA6Xzoudze,573,780
507793690832564224,2014-09-05 07:33:44,Teachers Day -  a day to thank all teachers from the classroom and beyond... #HappyTeachersDay ! http://t.co/gesY0QhVpa,851,1149
507075050143367168,2014-09-03 07:58:07,Nov 6 - 1st day of my last series. Sharing aspects of life was demanding. Thank you for the encouragement &amp; support #PlayingitMyWay on Nov 6,793,984
506742733143150592,2014-09-02 09:57:37,"#PlayingitMyWay, my autobiography will be available on Nov 6th. Here’s a little preview #Excited ! http://t.co/e7mZSQdlmQ",1965,1676
505755261097619457,2014-08-30 16:33:45,"#jeffrey_archer ""Whose arm is it anyway? Mightier than the sword!"" http://t.co/BuGCeOj7vh",475,887
505263166347943936,2014-08-29 07:58:20,"Bappa has come home, Ganapati Bappa Moraya!!!! http://t.co/6qjjqh8KEI",1351,2123
504556648476577792,2014-08-27 09:10:53,@kiranBarhate planting a tree is something that I have always encouraged. http://t.co/HP6lBlVmrt,115,235
504555923285610496,2014-08-27 09:08:00,@kiranBarhate planting a tree is something that I have always encouraged. http://t.co/bwqprF67DW,95,171
504551142487887873,2014-08-27 08:49:01,@manjiri_raje_27 happy birthday!! May God always keep you healthy n happy.,41,81
502817585520324609,2014-08-22 14:00:28,"This week the world of test cricket saw the last innings of a great player and a wonderful captain, Mahela Jayawardene. Well done buddy!!",1341,1596
502793553622224898,2014-08-22 12:24:59,@Anu_224 wish you many happy returns of the day. May God always give you a reason to smile :-),148,1322
502099683926220801,2014-08-20 14:27:47,"......Wish them the very best for their conquest of the 7th. For you both, even sky is not the limit!! http://t.co/S1zhP938jM",439,854
502099134346579968,2014-08-20 14:25:36,Amazing! Just met Nungshi and Tashi who have made us proud by scaling 6 of the highest peaks in 6 continents..... http://t.co/IRwsXEZly3,582,827
497662907383967744,2014-08-08 08:37:37,A big thank you to all my friends for their prayers n good wishes. My brother Ajit is recovering well after undergoing a bypass surgery.,811,1428
485183605002760192,2014-07-04 22:09:20,@JanviPatel04 Happy birthday Janvi! Hope you had a wonderful day. May God bless you &amp; your family with good health &amp; happiness always.,214,1463
459208214836289537,2014-04-24 05:52:24,"I have voted, have you? A wonderful start to my birthday, as a responsible citizen of our great nation. http://t.co/RXAtisMwqq",4967,5619
424219329601626113,2014-01-17 16:39:04,I support Apnalaya's initiative to make #dreamscometrue for underprivileged children. Great work of art by#georgesrousse in #shivajinagar,745,1281
422965151566811136,2014-01-14 05:35:25,Lohri greetings and happy Pongal to all my friends. May God bless us.,899,1355
422962112957120512,2014-01-14 05:23:20,"तिळगुळ घ्या, गोड गोड बोला..! * मकर संक्रांतिच्या हार्दिक शुभेच्छा *",968,1195
418293023701610497,2014-01-01 08:10:03,..... Feels great to be in Mumbai after long time to celebrate new years eve with my family and friends. Happy new year :-),963,1525
418292676870418432,2014-01-01 08:08:40,May God bless all of us with good health &amp; happiness in 2014. Nothing better than starting the new year with mother's blessings...,1209,1497
417889635109720066,2013-12-31 05:27:07,...... It's been a joy to have played against you. Jacques you are a  true Champion. Retired life isn't so bad :-)),2493,2148
417889033411235840,2013-12-31 05:24:44,@jacqueskallis75 Congratulations on a fabulous career. You have played the game in the right spirit....,882,596
415906532820529152,2013-12-25 18:06:59,Merry Christmas friends. Hope u hv a fun filled festive season. To b in a position to celebrate with family n friends makes it more special.,1210,1463
408910310548848640,2013-12-06 10:46:29,..... He will live on in my heart forever. R.I.P,1131,1291
408910064745869312,2013-12-06 10:45:31,When I met Mr Mandela it was one of the most memorable days of my life. A truly inspirational human being....,1760,1652
406026250398863360,2013-11-28 11:46:16,Saaf haath mein hi sabse zyada shakti hain. Look forward to spreading the word with UNICEF on washing hands and sanitation,1664,1499
400644348829650945,2013-11-13 15:20:31,I am really touched with #ThankYouSachin messages. Your support all these years have inspired me to give my best.,16698,12958
400643290782900224,2013-11-13 15:16:18,I thank you all from the bottom of my heart for 24 years of support. Hope you guys liked my messages via @BCCI,6719,6365
367663120736464896,2013-08-14 15:04:53,....My rendition of the poem in Marathi. Do share http://t.co/Sjh9SwEhC6,2018,1697
367662896135675905,2013-08-14 15:03:59,Delighted to support the #MARD initiative.  Lets be the men we all can be....,848,818
299350478721011712,2013-02-07 02:54:50,@MausamDesai96 wish u many happy returns of the day. May god bless u with happiness and good health :-),238,553
298009616531456001,2013-02-03 10:06:43,.. drinking water and sanitation so that children enjoy the opportunity to be educated. Donate here:http://t.co/vPOymtJN∙,823,1085
298009382451556353,2013-02-03 10:05:48,Friends:with Support My School we can change so many little lives. Contribute generously so that we can provide basic facilities of proper..,705,803
283408447997886464,2012-12-25 03:06:54,... Those magical moments of our ODI journey will stay with me for the rest of my life. Thank you so much :-),4524,4799
283408193370066944,2012-12-25 03:05:53,..&amp; especially now in the last couple of days. Your expressions have brought joy to my heart...&amp; at times a tear to my eye!...,2518,2599
283407918798368768,2012-12-25 03:04:47,Words are not enough to express my thanks to each of you for all the love &amp; support I have received over the years.....,3014,2863
253891548712955904,2012-10-04 16:17:16,'Happy Joy of Giving Week!Celebrate by donating to Apnalaya that works with slum kids.Matched by a generous donor–http://t.co/c719COmJ',605,974
253320275498782720,2012-10-03 02:27:14,@4Akarsh wish u many happy returns of the day. May God bless u with good health n happiness :-),68,145
251251833773903873,2012-09-27 09:27:59,http://t.co/l3wF65DC to make your contribution to helping build a better India. http://t.co/a1c3ReBM,398,594
251251326313451520,2012-09-27 09:25:58,in Mumbai slums for a better life for children. Your giving will make a huge impact. Please visit http://t.co/moYebafF  or ....,324,396
251249903018332160,2012-09-27 09:20:19,Join me in celebrating the Joy of Giving Week by donating to Apnalaya a very special NGO working.... http://t.co/6oU66oih,267,388
249704638788538368,2012-09-23 03:00:00,Guess who dropped in at home...? An amazing player and a wonderful friend :-) http://t.co/VPYxaNUI,2266,3701
248836101295452160,2012-09-20 17:28:44,@Meet_Rajpal love your helmet. Wish u safe riding :-),55,109
248336419444101121,2012-09-19 08:23:11,Ganpati bappa morya!!! http://t.co/VhjrPK7t,1190,2036
248335964521521152,2012-09-19 08:21:22,"May Lord Ganesha continue to look after us &amp; bless us with happiness, strength &amp; above all good health. Ganpati bappa morya!!!",789,588
245128980280250370,2012-09-10 11:57:57,... If not join me on http://t.co/qkoEzpva and be a part of this journey with me.,593,555
245128803200954368,2012-09-10 11:57:15,"Dear friends, welcome to my facebook page. I hope you had the chance to go through it.....",433,559
238179604668481536,2012-08-22 07:43:37,..On our way back to the hotel a quick stop to have minus 4 ice cream was a true delight :-),383,688
238178397908529152,2012-08-22 07:38:49,"Went to VVS Laxman's house to have dinner. It is always special to meet him. Such a wonderful guy, so simple and down to earth...",697,847
237455356161310721,2012-08-20 07:45:43,Eid Mubarak to all my friends.,772,680
236830946689691648,2012-08-18 14:24:32,...I will forever cherish the 16 years we have played together.,461,489
236830716179120128,2012-08-18 14:23:37,".. share some of my greatest cricketing moments with a true legend of the game and a thorough gentleman. VVS, the team &amp; i will miss you...",506,407
236830342521171968,2012-08-18 14:22:08,..one of the best players indian cricket has seen and i have played with will no longer be with me. It has been an absolute pleasure to...,396,379
236829985116155904,2012-08-18 14:20:43,"When i walk out to play in hyderabad i will feel a deep void. A void that can never be fulfilled. My dear friend, VVS Laxman....",536,397
236812172724957184,2012-08-18 13:09:56,"When i walk out to play in hyderabad i will feel a deep void. A void that can never be fulfilled. My dear friend, VVS Laxman...",1185,544
236086827520491520,2012-08-16 13:07:40,@namanpunjab thnx a lot :-) good luck to u.,39,68
235758814266269696,2012-08-15 15:24:16,@abhisheksahi15 wish u many happy returns of the day. May God bless u with happiness and good health in life.,28,51
235577882641055744,2012-08-15 03:25:18,The things that count in life are the things that can't be counted! Happy independence day!!,1935,808
235321229588975616,2012-08-14 10:25:27,@raghavanvng must say time flies. It has been an honour to represent India. As a child I always dreamt of playing cricket for my country.,47,57
234647677877493761,2012-08-12 13:49:00,"Sushil has done us proud by winning India its second silver medal. We are proud of his dedication, commitment and effort. Well done Sushil!!",1018,543
234615770292817921,2012-08-12 11:42:13,All our prayers and good wishes are with Sushil Kumar.,755,373
234614995122544640,2012-08-12 11:39:08,I am absolutely delighted for Yogeshwar. To win 3 bouts in 50 mins is incredible. We all r really proud of you.,469,263
234128170369024001,2012-08-11 03:24:40,@Khushboo_damani wish u many happy returns of the day. God bless u :-),28,42
233404898522300416,2012-08-09 03:30:38,@rakhi07priya hello how r u doing? Want to wish u all the best in life. Keep smiling,44,53
233240590878380032,2012-08-08 16:37:44,@namanpunjab thnx a lot for all the good wishes. Take care,28,51
233225107147988994,2012-08-08 15:36:13,Mary Kom is an amazing woman. What an effort to win a medal for India. We all are extremely proud of you.,1015,503
233045038156902400,2012-08-08 03:40:41,@diyalime wish u many happy returns of the day. A very cute daughter of my dear friend. God bless her.,24,51
233040135200063488,2012-08-08 03:21:12,@yuvii_sachinist thnx for all the good wishes and support over the years. Keep smiling,27,51
233039064201306112,2012-08-08 03:16:57,@jai_nagar wish u happy birthday for 11th Aug. May god bless u with good health.,25,45
232739183209361408,2012-08-07 07:25:20,Left early morning for Delhi and didn't catch the news. Sorry to hear that Vijender didn't make it.,168,183
232736346932908033,2012-08-07 07:14:03,@deepak_55 I started my training and practice from 23rd July. We will be playing our first test vs NZ on 23rd Aug in Hyderabad.,41,57
232735246754394112,2012-08-07 07:09:41,Good luck to Mary Kom and Vijender!! The entire nation is with you.,349,266
231752024180551680,2012-08-04 14:02:42,Terrific performance by Saina. To become only the second woman to win an Olympic medal for India is awesome. Congrats to Gopichand as well.,1152,498
231484582942355456,2012-08-03 20:20:00,Vijay Kumar's super performance makes us proud. Silver medal for India and now its Gold medal's turn. Come on India!!,777,437
231019454056759296,2012-08-02 13:31:44,.. but luckily we had to leave for a press conference or I would have been beaten hollow :),114,161
231019267150188545,2012-08-02 13:31:00,..who is responsible for bringing the event to India for the first time. I even started a game of chess with him...,90,144
231018836109955072,2012-08-02 13:29:17,"Chess Olympiad for the Blind taking place in Chennai next week. I spent time with Indian team and met Charudutta Jadhav,a dynamic person..",149,151
229920224479158272,2012-07-30 12:43:47,"Gagan Narang, you make us proud by winning the first medal in Olympics 2012. Let's hope &amp; pray that we follow it up by achieving many more.",1619,610
226082551540903936,2012-07-19 22:34:15,@Vikas_Shamsukha its nice that you understand. Wish u all the best in life.,34,60
